{
  "status": "DRAFT_LIVE_VERIFICATION_REQUIRED",
  "governance_source": "https://github.com/n923760-rgb/engineering-governance",
  "project_name": "Example Project",
  "repository": "owner/example-project",
  "repository_url": null,
  "default_branch": null,
  "official_branch": "main",
  "repository_authority_file": "AGENTS.md",
  "project_baseline": null,
  "architecture_guides": [],
  "subsystem_contracts": [],
  "master_roadmap": "ENGINEERING/MASTER_ROADMAP.md",
  "master_baseline_report": "ENGINEERING/REPORTS/MASTER_ENGINEERING_BASELINE_REPORT.md",
  "ci_system": null,
  "engineering_lab_contract": "governance/ENGINEERING_ENVIRONMENT_CONTRACT.md",
  "execution_environment": null,
  "verified_execution_capabilities": [],
  "controller": "Engineering Controller",
  "executor": "Engineering Executor",
  "protected_actions": [
    "credential_rotation",
    "destructive_billing_or_cloud_resource_actions",
    "destructive_database_migration",
    "destructive_infrastructure",
    "dns_changes",
    "force_push",
    "history_rewrite",
    "merge",
    "permanent_release_artifact_deletion",
    "production_credential_rotation",
    "production_database_operations",
    "production_deploy",
    "release",
    "repository_deletion",
    "server_or_cloud_destruction_or_reinstall",
    "signing",
    "store_publication",
    "tag"
  ],
  "test_strategy": "Smallest applicable deterministic contract test, then affected regressions",
  "evidence_location": "ENGINEERING/EVIDENCE/",
  "report_location": "ENGINEERING/REPORTS/",
  "artifact_location": null,
  "backup_restore_strategy": null,
  "release_model": null,
  "runtime_device_platform_matrix": [],
  "risk_profile": "STANDARD",
  "governance_lock": "governance/GOVERNANCE_LOCK.json"
}
